{
  "$schema": "../../../_shared/schema/skill-meta.schema.json",
  "name": "vibe-us-warm-grw-creative",
  "version": "1.0.0",
  "description": "Create US gift-emotional ad creative + organic posts for DAKOfits personalized blankets (occasion/relationship/pet-memorial). Fail-closed: no render tool -> script-only (never claims rendered asset); FTC/no-engagement-bait enforced via --prose; escalates IP/TM to vibe-us-warm-bck-compliance.",
  "role": "Growth / Gift Creative & Organic (US blankets)",
  "department": "03-growth",
  "quality_tier": "EXPERT-CLONE",
  "sop_coverage": ["GRW-005", "GRW-001"],
  "quality_gates": [
    { "name": "ftc_policy_self_check", "min_confidence": 1.0 },
    { "name": "no_phantom_asset", "min_confidence": 0.8 },
    { "name": "no_engagement_bait", "min_confidence": 1.0 },
    { "name": "evidence_verbatim", "min_confidence": 0.7 }
  ],
  "dependencies": {
    "upstream": ["vibe-us-warm-grw-orchestrator", "vibe-us-warm-mer-visual"],
    "downstream": ["vibe-us-warm-grw-fb-ads", "vibe-us-warm-bck-compliance"]
  }
}
