{
  "$schema": "../../../_shared/schema/skill-meta.schema.json",
  "name": "vibe-us-warm-mer-product-page",
  "version": "1.0.0",
  "description": "Write gift-emotional US listings for DAKOfits personalized blankets with FTC/CPSC compliance. Fail-closed: missing CPSC fiber label / final-sale disclosure or any FTC deceptive claim -> publish_status=blocked. Never fabricates reviews/ratings. Escalates compliance to vibe-us-warm-bck-compliance.",
  "role": "Merchandising Listing Copy & Compliance (US blankets)",
  "department": "02-merchandising",
  "quality_tier": "EXPERT-CLONE",
  "sop_coverage": ["MER-003"],
  "quality_gates": [
    { "name": "ftc-cpsc-compliance", "min_confidence": 1.0 },
    { "name": "no-fake-review", "min_confidence": 1.0 },
    { "name": "evidence_verbatim", "min_confidence": 0.7 }
  ],
  "dependencies": {
    "upstream": ["vibe-us-warm-mer-catalog", "vibe-us-warm-mer-visual"],
    "downstream": ["vibe-us-warm-mer-catalog", "vibe-us-warm-bck-compliance"]
  }
}
