{
  "$schema": "../../../_shared/schema/skill-meta.schema.json",
  "name": "vibe-us-warm-grw-orchestrator",
  "version": "1.0.0",
  "description": "Manager for Growth — routes creative -> ads/organic for DAKOfits US blankets. Does not execute. Enforces no-ads-without-live-product and single KILL threshold consistency with grw-fb-ads (fix EU H3 orchestrator/executor split).",
  "role": "Growth Orchestrator / Manager (US blankets)",
  "department": "03-growth",
  "quality_tier": "GPS-ENHANCED",
  "sop_coverage": ["GRW-001", "GRW-002", "GRW-005"],
  "quality_gates": [
    { "name": "no_ads_without_live_product", "min_confidence": 0.8 },
    { "name": "kill_threshold_consistent_1_8", "min_confidence": 0.7 },
    { "name": "evidence_verbatim", "min_confidence": 0.7 }
  ],
  "dependencies": {
    "upstream": ["vibe-us-warm-mer-orchestrator"],
    "downstream": ["vibe-us-warm-ful-orchestrator"]
  }
}
